<?xml version="1.0" encoding="UTF-8"?>
<tns:patient xmlns:tns="http://www.bycwebsolutions.org/Patient"
	xmlns:xsi="http://www.w3.org/2001/XMLSchema-instance"
	xsi:schemaLocation="http://www.bycwebsolutions.org/Patient ../schemas/Patient.xsd " id="1">
	<tns:name>Lance Fallon</tns:name>
	<tns:age>30</tns:age>
	<tns:dob>1986-10-12</tns:dob>
	<tns:gender>M</tns:gender>
	<tns:email>fallon.lance@gmail.com lance1086@hotmail.com</tns:email>
	<tns:phone>4108425526</tns:phone>
	<tns:payment>
		<tns:insurance>
			<tns:provider>Blue Cross</tns:provider>
			<tns:limit>2000</tns:limit>
		</tns:insurance>
	</tns:payment>
</tns:patient>
